id,intitule,description,dateCreation,dateActualisation,lieuTravail_libelle,lieuTravail_latitude,lieuTravail_longitude,lieuTravail_codePostal,lieuTravail_commune,typeContrat,typeContratLibelle,natureContrat,experienceExige,experienceLibelle,competences_code,competences_libelle,competences_exigence,salaire_commentaire,salaire_libelle,salaire_complement1,dureeTravailLibelle,dureeTravailLibelleConverti,alternance,contact_nom,contact_coordonnees1,contact_courriel,urlPostulation,secteurActivite,secteurActiviteLibelle,origineOffre_origine,origineOffre_urlOrigine,partenaires,offresManqueCandidats
8647416,Expert Tableau & Data H/F,"Notre client est un grand acteur du tourisme en France et en Europe qui compte plusieurs marques très connues. Les locaux sont basés à Paris dans le 19ème arrondissement et 3 jours de télétravail/semaine sont proposés. Le Groupe compte plus de  collaborateurs. La DSI comporte 300 collaborateurs répartis en 6 grandes directions. La DSI est rattachée à la holding et intervient en transverse pour chaque marque. Processus de recrutement : Entretien avec le Manager de l'équipe Analytics (N+1), Mise en situation et test technique avec un Expert Tableau, Entretien avec la Responsable du pôle Data (N+2). Rattaché à la DSI et plus précisément au Pôle Data, vous travaillerez au sein de l'équipe Analytics (composée de 10 personnes) en tant qu'Expert Tableau &amp; Data.  Rejoindre notre client comme Expert Tableau &amp; Data, c'est être un acteur clé dans le pilotage d'un outil d'analyse de données moderne et innovant tout en participant à un projet stratégique de transformation data au sein d'un environnement stimulant. L'équipe Analytics est dynamique et valorise l'initiative et la collaboration. Vos principales missions seront les suivantes : Assurer l'administration de Tableau, Etre un support aux utilisateurs, les monter en compétences et animer la communauté, Concevoir, maintenir et faire évoluer des dashboards performants et intuitifs sur Tableau, Participer à un gros projet de migration du socle de données Analytics sur GCP ainsi que la migration de SAP Business Objects (BO) vers Tableau. Cela implique de créer et contrôler des sources de données Tableau, de migrer/créer des dashboards et enfin d'accompagner les utilisateurs dans l'adoption de cet outil.    Accès séjour du personnel pour l'ensemble des marques, Primes intéressantes, Accord de participation, Avantages CSE (chèques vacances, pass culture, allocation voyage, carte cadeaux à noël), Télétravail jusqu'à 3 jours/semaine, Mutuelle et prévoyance prise en charge à 60% par l'employeur, RIE avec prise en charge patronale, Beauty room et salle de sport à prix attractif.",2025-06-24T15:45:32.000Z,2025-06-24T15:45:32.000Z,75,,,,75056,CDI,Contrat à durée indéterminée,Contrat travail,D,Débutant accepté,,,,,,,,,False,,,,,,,2,https://candidat.francetravail.fr/offres/recherche/detail/8647416,DIRECTEMPLOI (https://www.directemploi.com/candidatOffre/51828956?utm_source=pole-emploi&utm_medium=referral&utm_campaign=Pôle-Emploi),
8647360,Directeur de Domaine Data & Business Information H/F,"Notre client est un acteur majeur de l'assurance-crédit basé à Bois-Colombes (92), présent dans le monde entier et comptant  collaborateurs dont 800 en France. Processus de recrutement : Entretien avec le DSI Groupe (N+1), Entretien avec les Responsables métiers, Entretien avec le Directeur Stratégie &amp; Innovation, Entretien RH.   Le Directeur de domaine Data &amp; Business Information est responsable du maintien en conditions opérationnelles, de l'évolution continue des applications de son périmètre et de la direction des projets, dont le programme de mise en place d'une nouvelle plateforme très stratégique pour mieux récolter et valoriser les données. Il collabore étroitement avec le Sponsor Métier pour la gestion et l'évolution de son domaine d'activité. En fonction des objectifs, des priorités et des bénéfices attendus, il définit la feuille de route stratégique. Garant de l'avancement des projets et des versions applicatives, il veille à leur bon déroulement et, en coordination avec le sponsor, s'assure du respect des budgets alloués ainsi que de la réalisation des bénéfices escomptés. Rattaché au Directeur des Systèmes d'Informations, le Directeur de domaine Data &amp; Business Information manage une équipe d'une quarantaine de personnes (internes et externes confondus), dont des Managers techniques relais. Il supervise l'ensemble des ressources sur son périmètre applicatif, comprenant des Business Analysts, des Solution Analysts, des Product Owners ainsi que des Développeurs, des Ingénieurs Data. Il gère également les relations avec les fournisseurs de forfait et de TMA associés à son domaine, avec un budget d'environ 8M€.  La rémunération fixe est sur 12 mois, un variable de 20% est proposé et intéressement/participation (environ 6%). Les autres avantages comprennent : 30 jours de CP et 10 RTT, * 3 jours de télétravail/semaine, Tickets restaurant (12€/jour), Mutuelle intéressant, CE et remboursement loisirs, Un environnement de travail stimulant, Une culture d'entreprise axée sur l'innovation et l'amélioration continue, Des opportunités de développement professionnel. Nous encourageons vivement les candidats correspondant au profil recherché à postuler à ce poste passionnant dans une entreprise de premier plan dans le secteur de l'assurance.",2025-06-24T15:45:18.000Z,2025-06-24T15:45:18.000Z,92 - BOIS COLOMBES,48.915331,2.268837,92270,92009,CDI,Contrat à durée indéterminée,Contrat travail,D,Débutant accepté,,,,,,,,,False,,,,,,,2,https://candidat.francetravail.fr/offres/recherche/detail/8647360,DIRECTEMPLOI (https://www.directemploi.com/candidatOffre/51828959?utm_source=pole-emploi&utm_medium=referral&utm_campaign=Pôle-Emploi),
8647357,Consultant DATA Gouvernance H/F,"Notre client est une grande organisation industrielle. Ce sont des experts en matière de technologie qui mettent un point d'honneur à maintenir des standards de qualité élevés tout en encourageant l'innovation.  En tant que Consultant DATA Gouvernance, vous aurez les responsabilités suivantes : Gérer, organiser et protéger les données de l'entreprise ; Veiller à ce que les données soient précises, accessibles, sécurisées et utilisées de manière appropriée ; Collaborer étroitement avec les équipes internes pour comprendre leurs besoins en matière de données ; Élaborer des politiques et des procédures pour la collecte, l'utilisation et le partage de données ; Conseiller sur les meilleures pratiques en matière de gestion des données ; Assurer la conformité avec les lois et réglementations relatives à la protection des données ; Former le personnel à l'utilisation sûre et efficace des données.   Un contrat temporaire avec une grande organisation dans le secteur des Services aux Entreprises. C'est une excellente occasion de rejoindre une entreprise qui valorise l'innovation et la qualité.",2025-06-24T15:45:17.000Z,2025-06-24T15:45:17.000Z,75,,,,75056,LIB,Profession libérale,Emploi non salarié,D,Débutant accepté,,,,,,,,,False,,,,,,,2,https://candidat.francetravail.fr/offres/recherche/detail/8647357,DIRECTEMPLOI (https://www.directemploi.com/candidatOffre/51816563?utm_source=pole-emploi&utm_medium=referral&utm_campaign=Pôle-Emploi),
8647300,Data Engineer H/F,"Notre client est une organisation de taille moyenne opérant dans le secteur industriel. Elle se concentre sur l'innovation technologique et la fabrication de produits innovants. L'entreprise est actuellement en train de faire évoluer son environnement Data pour venir travailler sur des projets ambitieux. C'est dans ce cadre que nous recherchons un Data Engineer pour venir accompagner la structure dans ses beaux projets. Directement rattaché au DSI, vous aurez pour mission de : Concevoir et maintenir des bases de données robustes et optimisées ; Analyser les données pour fournir des insights pertinents aux équipes métier ; Collaborer avec les équipes de développement pour intégrer des solutions data-driven ; Élaborer des modèles prédictifs et des algorithmes pour optimiser les processus ; Assurer la sécurité et l'intégrité des données ; Documenter les processus et les flux de travail liés aux données ; Former les équipes internes sur les outils et les méthodologies de gestion des données.  Le package proposé pour cette fonction : Salaire selon profil, Intéressement et Participation, Accès à des projets innovants, Evolution professionnelle. Si ce poste vous intéresse, n'hésitez pas à postuler.",2025-06-24T15:45:01.000Z,2025-06-24T15:45:01.000Z,24 - ST SAUVEUR,44.869697,0.582385,24520,24499,CDI,Contrat à durée indéterminée,Contrat travail,D,Débutant accepté,,,,,,,,,False,,,,,,,2,https://candidat.francetravail.fr/offres/recherche/detail/8647300,DIRECTEMPLOI (https://www.directemploi.com/candidatOffre/51825706?utm_source=pole-emploi&utm_medium=referral&utm_campaign=Pôle-Emploi),
8646764,Développeur Data Analyst (H/F) - LYON,"Fort de 70 ans d'expertise, notre client est un acteur important du secteur de la protection juridique en France en permettant à chacun, un accès facilité au droit et à la justice. C'est dans ce contexte que nous avons besoin de vos compétences : rattaché(e) au DSI, vous allez travailler au sein d'une équipe à taille humaine de sept personnes.Dans le cadre de la mise en œuvre des projets du SI, vous manipulerez des bases de données, participerez aux développements et paramétrages des progiciels nécessaires, tout en assurant le support aux utilisateurs.Vos responsabilités au quotidien :Analyse des besoins métiers : contribuer à la définition des spécifications générales rédigées par les Chefs de Projets, rédiger l&apos;analyse technique ainsi que l'étude détaillée et s'assurer de la validation des dossiers Développement spécifique ou paramétrage : développer et paramétrer des outils, des interfaces applicatives, ou scripts de reprise de donnéesQualification des développements : élaborer les jeux d'essais pour les tests unitaires d'intégration, effectuer les tests unitaires, identifier et traiter les dysfonctionnementsRecettage utilisateur (en coordination avec les Chefs de Projet et les Utilisateurs) : préparer les recettes utilisateurs, assurer les correctifs et compléments d'études détailléesMaintenance des applications : assurer le support technique et fonctionnel aux utilisateurs sur les applications dont vous avez la charge et effectuer le suivi demandes en les documentant. S'assurer de la satisfaction des équipes métiers, et coordonner vos actions avec les prestataires#QuelleRepartition : 60% analyses et développements / 40% manipulation de donnéesRémunération:",2025-06-24T15:43:04.000Z,2025-06-24T15:43:04.000Z,69,,,,69123,CDI,Contrat à durée indéterminée,Contrat travail,D,Débutant accepté,,,,,,,,,False,,,,,,,2,https://candidat.francetravail.fr/offres/recherche/detail/8646764,DIRECTEMPLOI (https://www.directemploi.com/candidatOffre/51786171?utm_source=pole-emploi&utm_medium=referral&utm_campaign=Pôle-Emploi),
8646134,ALTERNANT(E) - C&B et Data RH (H/F),"ALTERNANT(E) - C&B et Data RH Temps partiel Description de l'entreprise Nous sommes SGS, le leader mondial du testing, de l'inspection et de la certification. Reconnue comme la référence en termes de qualité et d'intégrité, SGS exploite un réseau de plus de  bureaux et laboratoires à travers le monde et emploie plus de  collaborateurs travaillant ensemble pour permettre un monde meilleur, plus sûr et plus interconnecté. Pourquoi rejoindre la team SGS ? SGS est un groupe international ...",2025-06-24T15:41:14.000Z,2025-06-24T15:41:14.000Z,94 - ARCUEIL,48.805178,2.333471,94110,94003,CDI,Contrat à durée indéterminée,Contrat travail,D,Débutant accepté,,,,,,,,,False,,,,,,,2,https://candidat.francetravail.fr/offres/recherche/detail/8646134,DIRECTEMPLOI (https://www.directemploi.com/candidatOffre/51780189?utm_source=pole-emploi&utm_medium=referral&utm_campaign=Pôle-Emploi),
8645977,Apprenti Transformation Digitale - Data et Intelligence Artificielle F/H/N (H/F),"Apprenti Transformation Digitale - Data et Intelligence Artificielle F/H/N Temps complet Legal Entity: e.l.m. leblanc SAS Description de l'entreprise Chez Bosch, nous façonnons le futur en inventant des technologies de pointe et des services qui visent à susciter l'enthousiasme et améliorer la vie quotidienne. Nous vous offrons de travailler sur des métiers passionnants dans un contexte de travail international et un environnement innovant et dynamique. Bosch France est une filiale du Groupe Bos...",2025-06-24T15:40:48.000Z,2025-06-24T15:40:48.000Z,93 - DRANCY,48.924157,2.444197,93700,93029,CDI,Contrat à durée indéterminée,Contrat travail,D,Débutant accepté,,,,,,,,,False,,,,,,,2,https://candidat.francetravail.fr/offres/recherche/detail/8645977,DIRECTEMPLOI (https://www.directemploi.com/candidatOffre/51780565?utm_source=pole-emploi&utm_medium=referral&utm_campaign=Pôle-Emploi),
8645888,Data Gouvernance & Management : Comment maitriser et valoriser la donnée à travers un modèle de gouvernance pragmatique et efficient ? (H/F),"Data Gouvernance & Management : Comment maitriser et valoriser la donnée à travers un modèle de gouvernance pragmatique et efficient ? Stage Description de l'entreprise Wavestone est un cabinet de conseil, qui a pour mission d'accompagner les entreprises et organisations dans leurs transformations stratégiques dans un monde en constante évolution, avec l'ambition de générer des impacts positifs et durables pour toutes ses parties prenantes. Forts de plus de  collaborateur.rices talentueux.s...",2025-06-24T15:40:31.000Z,2025-06-24T15:40:31.000Z,75,,,,75056,CDI,Contrat à durée indéterminée,Contrat travail,D,Débutant accepté,,,,,,,,,False,,,,,,,2,https://candidat.francetravail.fr/offres/recherche/detail/8645888,DIRECTEMPLOI (https://www.directemploi.com/candidatOffre/51774153?utm_source=pole-emploi&utm_medium=referral&utm_campaign=Pôle-Emploi),
8645780,R&D DATA & BIOSTATISTIC MANAGER - H/F,"R&D DATA & BIOSTATISTIC MANAGER - H/F Temps complet Expérience: 5 à 10 ans Activity: Animal Nutrition & Health Type de contrat: Permanent Contract Description de l'entreprise Acteur mondial de référence dans le domaine des levures et de la fermentation, Lesaffre conçoit, produit et apporte des solutions innovantes pour la panification, le goût & plaisir alimentaire, le bien-être & la santé et la biotechnologie. Groupe familial, né dans le Nord de la France en , aujourd'hui multi-local et plu...",2025-06-24T15:40:09.000Z,2025-06-24T15:40:09.000Z,59 - MARCQ EN BAROEUL,50.676748,3.100594,59700,59378,CDI,Contrat à durée indéterminée,Contrat travail,D,Débutant accepté,,,,,,,,,False,,,,,,,2,https://candidat.francetravail.fr/offres/recherche/detail/8645780,DIRECTEMPLOI (https://www.directemploi.com/candidatOffre/51774288?utm_source=pole-emploi&utm_medium=referral&utm_campaign=Pôle-Emploi),
8645653,Consultant Senior Tech Risk - Data Advisory Financial Services (H/F),"Consultant Senior Tech Risk - Data Advisory Financial Services (H/F) Temps complet Description de l'entreprise Forvis Mazars est un groupe international d'audit, de fiscalité et de conseil. Avec + de  collaborateurs présents dans une centaine de pays, nous faisons partie du Top 10 des cabinets mondiaux. Nous faisons des métiers sérieux... sans se prendre au sérieux. Faire partie de nos équipes, c'est avant tout assumer sa singularité et oser partager ses idées, dans une ambiance de travail...",2025-06-24T15:39:43.000Z,2025-06-24T15:39:43.000Z,92 - COURBEVOIE,48.897974,2.257057,92400,92026,CDI,Contrat à durée indéterminée,Contrat travail,D,Débutant accepté,,,,,,,,,False,,,,,,,2,https://candidat.francetravail.fr/offres/recherche/detail/8645653,DIRECTEMPLOI (https://www.directemploi.com/candidatOffre/51775652?utm_source=pole-emploi&utm_medium=referral&utm_campaign=Pôle-Emploi),
8645353,Data Project Manager H/F,"Data Project Manager H/F Temps complet Business Line: Consulting and Operations Contrat: Contrat à durée indéterminée Service Line: OnM Indirect Région: Reg France Job Family: Numérique, information et technologie Profession: Données Description de l'entreprise Egis est un groupe international de conseil, d'ingénierie de la construction et d'exploitation qui œuvre dans le monde entier pour des territoires plus équilibrés, plus durables et plus résilients. Conseil et Exploitation offre une contin...",2025-06-24T15:38:46.000Z,2025-06-24T15:38:46.000Z,78 - GUYANCOURT,48.772152,2.070024,78280,78297,CDI,Contrat à durée indéterminée,Contrat travail,D,Débutant accepté,,,,,,,,,False,,,,,,,2,https://candidat.francetravail.fr/offres/recherche/detail/8645353,DIRECTEMPLOI (https://www.directemploi.com/candidatOffre/51778295?utm_source=pole-emploi&utm_medium=referral&utm_campaign=Pôle-Emploi),
8644817,Senior Consultant/Manager - Data Architect et/ou Data Engineer - H/F - CDI,"Senior Consultant/Manager - Data Architect et/ou Data Engineer - H/F - CDI Temps complet Description de l'entreprise Wavestone est un cabinet de conseil, qui a pour mission d'accompagner les entreprises et organisations dans leurs transformations stratégiques dans un monde en constante évolution, avec l'ambition de générer des impacts positifs et durables pour toutes ses parties prenantes. Forts de plus de  collaborateurs talentueux et engagés à travers l'Europe, l'Amérique du Nord et l'Asi...",2025-06-24T15:37:10.000Z,2025-06-24T15:40:31.000Z,75,,,,75056,CDI,Contrat à durée indéterminée,Contrat travail,D,Débutant accepté,,,,,,,,,False,,,,,,,2,https://candidat.francetravail.fr/offres/recherche/detail/8644817,DIRECTEMPLOI (https://www.directemploi.com/candidatOffre/51770880?utm_source=pole-emploi&utm_medium=referral&utm_campaign=Pôle-Emploi),
8644651,CLOUD FORWARD : Pourquoi les écosystèmes Data dans le Cloud sont-ils le seul avenir viable ? (H/F),"CLOUD FORWARD : Pourquoi les écosystèmes Data dans le Cloud sont-ils le seul avenir viable ? Stage Description de l'entreprise Wavestone est un cabinet de conseil, qui a pour mission d'accompagner les entreprises et organisations dans leurs transformations stratégiques dans un monde en constante évolution, avec l'ambition de générer des impacts positifs et durables pour toutes ses parties prenantes. Forts de plus de  collaborateurs talentueux et engagés à travers l'Europe, l'Amérique du Nor...",2025-06-24T15:36:42.000Z,2025-06-24T15:36:42.000Z,75,,,,75056,CDI,Contrat à durée indéterminée,Contrat travail,D,Débutant accepté,,,,,,,,,False,,,,,,,2,https://candidat.francetravail.fr/offres/recherche/detail/8644651,DIRECTEMPLOI (https://www.directemploi.com/candidatOffre/51770887?utm_source=pole-emploi&utm_medium=referral&utm_campaign=Pôle-Emploi),
8644616,Manager Data Gouvernance & Advisory Financial Services (H/F),"Manager Data Gouvernance & Advisory Financial Services (H/F) Temps complet Description de l'entreprise Forvis Mazars est un groupe international d'audit, de fiscalité et de conseil. Avec + de  collaborateurs présents dans une centaine de pays, nous faisons partie du Top 10 des cabinets mondiaux. Nous faisons des métiers sérieux... sans se prendre au sérieux. Faire partie de nos équipes, c'est avant tout assumer sa singularité et oser partager ses idées, dans une ambiance de travail que nou...",2025-06-24T15:36:36.000Z,2025-06-24T15:36:36.000Z,92 - LEVALLOIS PERRET,48.894215,2.286846,92300,92044,CDI,Contrat à durée indéterminée,Contrat travail,D,Débutant accepté,,,,,,,,,False,,,,,,,2,https://candidat.francetravail.fr/offres/recherche/detail/8644616,DIRECTEMPLOI (https://www.directemploi.com/candidatOffre/51775435?utm_source=pole-emploi&utm_medium=referral&utm_campaign=Pôle-Emploi),
8644603,"Luxe, Beauté & Retail - L'exploitation de la data sur le marché du luxe, de la beauté et du retail (H/F)","Luxe, Beauté & Retail - L'exploitation de la data sur le marché du luxe, de la beauté et du retail Stage Description de l'entreprise Dans un monde où savoir se transformer est la clé du succès, Wavestone s'est donné pour mission d'éclairer et guider les grandes organisations dans leurs transformations les plus critiques. Des transformations qui visent à répondre aux grands enjeux stratégiques auxquels elles vont faire face dans les années à venir : l'accélération de la révolution numérique, l'in...",2025-06-24T15:36:34.000Z,2025-06-24T15:36:34.000Z,75,,,,75056,CDI,Contrat à durée indéterminée,Contrat travail,D,Débutant accepté,,,,,,,,,False,,,,,,,2,https://candidat.francetravail.fr/offres/recherche/detail/8644603,DIRECTEMPLOI (https://www.directemploi.com/candidatOffre/51774152?utm_source=pole-emploi&utm_medium=referral&utm_campaign=Pôle-Emploi),
8644338,Développeur Data Analyst (H/F) - LYON,"Développeur Data Analyst (H/F) - LYON Temps complet Description de l'entreprise Vous êtes passionné(e) par le développement applicatif et souhaitez faire de cette passion votre quotidien ? Protéger, conseiller et accompagner sont des valeurs fortes qui vous animent ? Alors donnez un nouvel envol à votre carrière grâce à notre poste de Développeur Data Analyst H/F , à pourvoir actuellement en CDI sur Lyon . Description du poste Fort de 70 ans d'expertise, notre client est un acteur important du s...",2025-06-24T15:35:50.000Z,2025-06-24T15:35:50.000Z,69,,,,69123,CDI,Contrat à durée indéterminée,Contrat travail,D,Débutant accepté,,,,,,,,,False,,,,,,,2,https://candidat.francetravail.fr/offres/recherche/detail/8644338,DIRECTEMPLOI (https://www.directemploi.com/candidatOffre/51774348?utm_source=pole-emploi&utm_medium=referral&utm_campaign=Pôle-Emploi),
8644311,Faire de la Data un Asset pour l'organisation grâce à l'IA et la BI (H/F),"Faire de la Data un Asset pour l'organisation grâce à l'IA et la BI Stage Description de l'entreprise Wavestone est un cabinet de conseil, qui a pour mission d'accompagner les entreprises et organisations dans leurs transformations stratégiques dans un monde en constante évolution, avec l'ambition de générer des impacts positifs et durables pour toutes ses parties prenantes. Forts de plus de  collaborateurs talentueux et engagés à travers l'Europe, l'Amérique du Nord et l'Asie, nous disposo...",2025-06-24T15:35:45.000Z,2025-06-24T15:35:45.000Z,75,,,,75056,CDI,Contrat à durée indéterminée,Contrat travail,D,Débutant accepté,,,,,,,,,False,,,,,,,2,https://candidat.francetravail.fr/offres/recherche/detail/8644311,DIRECTEMPLOI (https://www.directemploi.com/candidatOffre/51770901?utm_source=pole-emploi&utm_medium=referral&utm_campaign=Pôle-Emploi),
