id,intitule,description,dateCreation,dateActualisation,lieuTravail_libelle,lieuTravail_latitude,lieuTravail_longitude,lieuTravail_codePostal,lieuTravail_commune,typeContrat,typeContratLibelle,natureContrat,experienceExige,experienceLibelle,competences_code,competences_libelle,competences_exigence,salaire_commentaire,salaire_libelle,salaire_complement1,dureeTravailLibelle,dureeTravailLibelleConverti,alternance,contact_nom,contact_coordonnees1,contact_courriel,urlPostulation,secteurActivite,secteurActiviteLibelle,origineOffre_origine,origineOffre_urlOrigine,partenaires,offresManqueCandidats
8648097,Data & Integration Engineer H/F,"Notre client est un Groupe mondial qui se distingue par son approche dynamique et innovante dans le secteur du transport de passagers. En pleine expansion, il cherche à attirer des talents prêts à contribuer à leur succès. L'entreprise compte  collaborateurs et la DSI est composée de 70 collaborateurs répartis en 6 directions. Processus de recrutement : Entretien 1 avec RH et Responsable Data (N+1) par Teams, Entretien 2 avec le Responsable Data dans les locaux. Le poste est à pourvoir en CDI en interne, directement chez le client final.  En tant que Data &amp; Integration Engineer, vous êtes rattaché au Responsable Data (N+1) et travaillez dans l'équipe Data &amp; Integration au sein de laquelle de gros enjeux et projets sont à gérer. Dans votre rôle de Data &amp; Integration Engineer, vos principales missions seront les suivantes : Gestion des projets d'intégration : Vous serez responsable de l'intégration des systèmes en veillant à respecter des critères stricts de disponibilité, de fiabilité et de résilience. Pour ce faire, vous appliquerez des modèles d'architecture éprouvés comme par exemple « Message Broker », API : vous mettrez en place une solution complète d'API Management, incluant la création d'un catalogue d'API, Supervision des flux de données : Vous prendrez en charge la recette des flux et assurerez leur suivi en production, en résolvant les incidents qui pourraient survenir, Support technique sur les architectures Cloud Azure : Vous fournirez des conseils techniques sur les architectures Cloud, en collaborant étroitement avec les fournisseurs de solutions et les consultants externes, Amélioration continue des processus : Vous travaillerez sur l'optimisation des processus internes, notamment la localisation et la traçabilité des données, la standardisation des flux de données et la documentation associée, Collaboration avec les équipes internationales. Prime sur objectifs représentant 7,5% de la rémunération fixe brut annuelle, 2 jours de télétravail/semaine, Remboursement de la carte Navigo à hauteur de 80% ou défraiement kilométrique, Tickets restaurants, Avantages conséquents sur les transports, RTT, CE intéressant (300€/an).",2025-06-24T15:48:16.000Z,2025-06-24T15:48:16.000Z,94 - ORLY,48.742287,2.395245,94310,94054,CDI,Contrat à durée indéterminée,Contrat travail,D,Débutant accepté,,,,,,,,,False,,,,,,,2,https://candidat.francetravail.fr/offres/recherche/detail/8648097,DIRECTEMPLOI (https://www.directemploi.com/candidatOffre/51816266?utm_source=pole-emploi&utm_medium=referral&utm_campaign=Pôle-Emploi),
8648081,Data Manager H/F,"Notre client compte aujourd'hui plus de  collaborateurs au sein de ses 27 filiales réparties dans le monde. L'entreprise connaît une croissance constante et sa DSI est actuellement en pleine transformation. Vous évoluerez au siège basé à Roissy-en-France (95). Les valeurs du Groupe sont les suivantes : Engagement - ouverture d'esprit- respect - intégrité - recherche d'amélioration. Vous serez directement rattaché au CIO. Processus : CIO sur Teams, CIO et RH sur site, Questionnaire de personnalité avec restitution sur teams. En tant que Data Manager, vous occuperez un rôle-clé en garantissant la fiabilité, l'accessibilité et la sécurité des données. Vous serez le pilier de la gouvernance des données. Vos missions seront les suivantes : Modélisation : Concevoir, mettre à jour et documenter le modèle conceptuel de données, (MCD), Définir et gérer les données de référence essentielles aux processus métiers. Gouvernance et qualité des données : Recueillir, analyser et traiter les demandes de création ou modification des données en collaboration avec les référents métiers, Définir et mettre en oeuvre les règles de gouvernance pour assurer le suivi et le cycle de vie des données, Suivre et améliorer la qualité des données en définissant des KPI et en mettant en place des actions correctives, Analyser les causes profondes des problèmes de non-qualité et proposer des plans d'amélioration.  Sécurité et conformitDéfinir et mettre à jour les règles de sécurité et d'accès aux données (GDPR, FDA.), S'assurer du respect des normes et réglementations en matière de protection des données. Formation : Sensibiliser et former les équipes aux bonnes pratiques de gestion des données, Accompagner les différents services dans l'amélioration continue des processus liés à la data. Rémunération sur 12 mois, Bonus de 5% sur performance, Prime d'intéressement, 2 jours de TT par semaine, CE attractif.",2025-06-24T15:48:12.000Z,2025-06-24T15:48:12.000Z,95 - ROISSY EN FRANCE,48.997813,2.513436,95700,95527,CDI,Contrat à durée indéterminée,Contrat travail,D,Débutant accepté,,,,,,,,,False,,,,,,,2,https://candidat.francetravail.fr/offres/recherche/detail/8648081,DIRECTEMPLOI (https://www.directemploi.com/candidatOffre/51829035?utm_source=pole-emploi&utm_medium=referral&utm_campaign=Pôle-Emploi),
8647932,Data Engineer H/F,"Notre client est un leader mondial des services multi-techniques, spécialisé dans les solutions d'énergie, de digital et de génie climatique. L'entreprise accompagne ses clients dans leur transition énergétique et numérique grâce à une expertise pointue et des solutions sur mesure. Le poste de Data Engineer/Leader Technique Data est à pourvoir au sein de la DSI France. Il s'agit d'une création de postes et en forte interaction avec les autres acteurs Data du Groupe.  Pour ce poste de Data Engineer / Leader Technique Data évolutif rapidement vers un poste d'Architecte Data, vos missions principales seront les suivantes : Concevoir et implémenter l'architecture data, en cohérence avec les standards IT Corporate, Définir et superviser l'intégration des données issues de sources variées, en garantissant leur qualité et leur sécurité, Orchestrer, configurer et optimiser les traitements data (performance, robustesse, fiabilité), Mettre en place les outils de monitoring et de supervision des flux et des pipelines, Prendre en charge la gestion des incidents et assurer la continuité de service, Collaborer avec les équipes data, IT et projets pour décliner les meilleures pratiques d'architecture, Agir en tant que référent technique et accompagner les Développeurs Data et les Data Analyst dans leurs montées en compétences, Documenter les solutions mises en place (schémas d'architecture, procédures techniques), Assurer une veille technologique active et proposer des améliorations innovantes. L'environnement technique de mon client est le suivant : Palantir Foundry/Python/Power BI/Git/échanges de données : API REST, SFTP, MQTT, etc.  Package Attractif comprenant : Salaire fixe, Salaire Variable, Une entreprise qui propose des grosses possibilités d'évolution, Un rôle évolutif sur de l'architecture, Un environnement bienveillant et challengeant, Un contexte international.",2025-06-24T15:47:34.000Z,2025-06-24T15:47:34.000Z,92 - COURBEVOIE,48.897974,2.257057,92400,92026,CDI,Contrat à durée indéterminée,Contrat travail,D,Débutant accepté,,,,,,,,,False,,,,,,,2,https://candidat.francetravail.fr/offres/recherche/detail/8647932,DIRECTEMPLOI (https://www.directemploi.com/candidatOffre/51828949?utm_source=pole-emploi&utm_medium=referral&utm_campaign=Pôle-Emploi),
8647734,Consultant/Développeur Data H/F,"Notre client est une entreprise de taille moyenne opérant dans le secteur de la technologie et des télécommunications. Avec une présence significative dans plusieurs grandes villes de France, il est connu pour son approche innovante et son engagement envers la qualité.  En tant que Consultant/Développeur Data, vos responsabilités incluront : Développement et mise en oeuvre de solutions de données ; Gestion et analyse des bases de données ; Collaboration avec les équipes techniques pour améliorer les systèmes existants ; Assurer la qualité des données et leur conformité aux normes de l'industrie ; Résolution des problèmes techniques liés aux données ; Présentation des résultats d'analyse aux parties prenantes internes ; Formation des utilisateurs finaux sur les nouvelles fonctionnalités de données ; Suivi des tendances et des évolutions dans le domaine de la data.   Voici ce que notre client vous offre pour le poste de Consultant/Développeur Data : Un salaire compris entre 50 et 55K€ ; Une expérience enrichissante dans le secteur de la technologie et des télécommunications ; La possibilité de travailler avec une équipe dédiée et professionnelle ; Des opportunités de formation continue ; Un environnement de travail stimulant et innovant. N'hésitez pas à postuler si vous pensez que cette opportunité correspond à vos compétences et à vos ambitions. Nous nous réjouissons de recevoir votre candidature.",2025-06-24T15:46:48.000Z,2025-06-24T15:46:48.000Z,67 - STRASBOURG,48.579831,7.761454,67000,67482,LIB,Profession libérale,Emploi non salarié,D,Débutant accepté,,,,,,,,,False,,,,,,,2,https://candidat.francetravail.fr/offres/recherche/detail/8647734,DIRECTEMPLOI (https://www.directemploi.com/candidatOffre/51816322?utm_source=pole-emploi&utm_medium=referral&utm_campaign=Pôle-Emploi),
8647720,Data Analyst - BI H/F,"Notre client est une organisation de taille moyenne. Ils possèdent une équipe dédiée à la technologie et cherchent à renforcer leur capacité à analyser et à utiliser efficacement les données.En tant que Data Analyst - BI, vous aurez les responsabilités suivantes : Analyser et interpréter les données complexes pour aider à la prise de décision ; Travailler en étroite collaboration avec l'équipe technologique pour comprendre les besoins en matière de données ; Concevoir les flux de données ETL pour la BI (Stambia/Semarchy) ; Collaborer avec diverses parties prenantes pour comprendre leurs besoins en matière de données ; Effectuer des analyses prédictives pour aider à la planification stratégique ; Assurer la qualité et l'intégrité des données ; Contribuer à l'élaboration de la stratégie de gestion des données de l'entreprise ; Restez à jour avec les dernières tendances et technologies en matière d'analyse de données. Le package proposé pour cette fonction comprend : Un salaire annuel de  à  euros ; Une prime de participation ; Des avantages liés à la qualité de vie au travail ; Un poste basé à Lille dans une entreprise reconnue.",2025-06-24T15:46:44.000Z,2025-06-24T15:46:44.000Z,59 - LILLE,50.630993,3.045449,59000,59350,CDI,Contrat à durée indéterminée,Contrat travail,D,Débutant accepté,,,,,,,,,False,,,,,,,2,https://candidat.francetravail.fr/offres/recherche/detail/8647720,DIRECTEMPLOI (https://www.directemploi.com/candidatOffre/51801415?utm_source=pole-emploi&utm_medium=referral&utm_campaign=Pôle-Emploi),
8647715,Data & IA Engineer H/F,"Notre client est un acteur majeur du monde de la construction et du bâtiment. Présent sur tout le territoire national, la DSI est un moteur d'innovation et de transformation du Groupe. Au sein d'une DSI de 50 personnes, vous intégrez le Pôle Architecture et Sécurité. La data plateforme de notre client répond aux standards modernes (Data Lake S3, DBT, Glue).  Pour ce rôle de Data Engineer, les missions prévues sont les suivantes : Concevoir, développer et optimiser les fonctionnalités de la Modern Data Platform du Groupe, Structurer, construire et maintenir les pipelines de données, Contribuer activement aux projets d'IA Générative, Assurer le DataOps (la connaissance de  Terraform est un atout), Collaborer avec les équipes métier pour comprendre leurs besoins et concevoir des solutions Data et IA adaptées, Interagir avec les équipes Dev et Infra pour intégrer les solutions Data et IA dans les processus CI/CD &amp; Ops, Construire des tableaux de bord et indicateurs et contribuer à l'évolution du socle technique  DataViz pour permettre (la MAJ) le temps réel , Assurer une veille technologique constante et participer aux réflexions sur les bonnes pratiques en matière de gestion des données.    Vous rejoignez une entreprise à taille humaine, Le projet autour de la Data et de l'IA est mature mais beaucoup de choses restent à faire : Le terrain de jeu pour un passionné de la data est grand, Les possibilités de progression sont fortes.",2025-06-24T15:46:42.000Z,2025-06-24T15:46:42.000Z,73 - CHAMBERY,45.583223,5.909299,73000,73065,CDI,Contrat à durée indéterminée,Contrat travail,D,Débutant accepté,,,,,,,,,False,,,,,,,2,https://candidat.francetravail.fr/offres/recherche/detail/8647715,DIRECTEMPLOI (https://www.directemploi.com/candidatOffre/51801332?utm_source=pole-emploi&utm_medium=referral&utm_campaign=Pôle-Emploi),
8647664,CA-CIB - Développeur Back-End Java Big Data H/F,"A la pointe de l'innovation technologique, les équipes IT de CA-CIB accompagnent sur le plan technique et fonctionnel, les activités et projets de développement des différents métiers de la Banque de Financements et d'Investissement dans un environnement international. En intégrant une filière informatique de plus de  Collaborateurs, vous bénéficierez de multiples opportunités professionnelles, grâce à la diversité des métiers de CA-CIB et à leurs parcours évolutifs au sein des entités du Groupe. Michael Page recrute un Développeur Back-End Java Big Data lors d'une journée de recrutement le 25 juin  chez CA-CIB. Au sein de la DSI, vous évoluerez dans un environnement particulièrement stimulant en tant que Développeur Back-End Java sur des applications coeur de métier. En tant que Développeur Back-End Java Big Data, vos responsabilités consisterontComprendre les besoins client et leur traduction en fonctions applicatives, Travailler étroitement avec les Analystes, les designers et les équipes en charge du support et des infrastructures, Ecrire un code de qualité pour programmer des applications complètes dans les temps et concevoir des prototypes créatifs selon les spécifications, Participer à la mise en place de nouvelles architectures (API, micro-services, exploitabilité des données.), Garantir que les contraintes d'assurance qualité, de performance, de stabilité, de maintenabilité et d'évolutivité sont respectées, Respecter les standards de développement mis en place (CI/CD, DDD) et promouvoir les pratiques de tests systématiques, Elaborer des documents techniques et manuels pour représenter précisément la conception applicative et le code source. La rémunération et les avantages à ce poste sont : Un contrat à durée indéterminée (CDI) ; Une possibilité de télétravail jusqu'à 2 jours par semaine ; L'adhésion à la convention collective de la banque ; Un programme d'intéressement ; L'accès à un CSE très dynamique. Nous encourageons vivement tous les candidats intéressés à postuler à ce poste passionnant et stimulant au sein d'une organisation de premier plan dans le secteur des services financiers. Processus de recrutement : Test de Coding Games ; Journée de job dating le 25 juin  avec rencontres des managers et Tech Lead sur le campus de CA-CIB ; Entretien Teams plus échange RH ; Réponse sous 72H après la fin du processus de 3 jours.",2025-06-24T15:46:31.000Z,2025-06-24T15:46:31.000Z,92 - MONTROUGE,48.815929,2.316207,92120,92049,CDI,Contrat à durée indéterminée,Contrat travail,D,Débutant accepté,,,,,,,,,False,,,,,,,2,https://candidat.francetravail.fr/offres/recherche/detail/8647664,DIRECTEMPLOI (https://www.directemploi.com/candidatOffre/51816543?utm_source=pole-emploi&utm_medium=referral&utm_campaign=Pôle-Emploi),
8647652,Data Scientist Senior Risque de Crédit H/F,"Ce recrutement est géré par Michael Banque et Services Financiers, spécialiste du recrutement de cadres confirmés pour l'ensemble des acteurs en banque, assurances, asset management, sociétés de financements spécialisés, Fintech, etc. Notre client est un Groupe de renommée en France. Il est basé à Puteaux, La Défense (92).  Au sein de la Direction des Risques, dans l'équipe Data Analytique et Risque de Crédit et au sein du Pôle « modélisation », vous avez la responsabilité des travaux de modélisation des risques de crédit dans le cadre du passage en méthode avancée (IRBA) de la filière affacturage. En tant que Data Scientist Senior Risque de Crédit, vos missions sont les suivantes : Développer et suivre les modèles utilisés au sein de la filière, Piloter le projet d'homologation de la filière, pour le passage en méthode avancée du calcul des exigences, réglementaires Bâle 3 : Suivi du défaut, développement de modèles internes pour les calculs d'exigence de fonds propres, etc. Suivre les risques de crédit sur le portefeuille et réaliser les reportings réglementaires risques, Suivre le provisionnement des dossiers risqués, Présenter les travaux aux instances de gouvernance, Rédiger la documentation en vue de la demande d'homologation de la BCE, Assurer un rôle de référent technique au sein de l'équipe sur les projets de modélisation, S'assurer de la gouvernance de la donnée. Cette liste n'est pas limitative.  2 jours de télétravail possible/semaine.",2025-06-24T15:46:28.000Z,2025-06-24T15:46:28.000Z,92 - PUTEAUX,48.884156,2.237199,92800,92062,CDI,Contrat à durée indéterminée,Contrat travail,D,Débutant accepté,,,,,,,,,False,,,,,,,2,https://candidat.francetravail.fr/offres/recherche/detail/8647652,DIRECTEMPLOI (https://www.directemploi.com/candidatOffre/51816504?utm_source=pole-emploi&utm_medium=referral&utm_campaign=Pôle-Emploi),
8647466,Développeur BI - Environnement Data and Décisionnel H/F,"Structure française en croissance, présente à l'international, avec une culture d'entreprise conviviale et un ADN fort autour de l'innovation, de la simplicité et de l'humain.  Rattaché au Chef de Projet BI et au DSI, vous contribuez à la performance de la chaîne décisionnelle en assurant : Le pilotage et la maintenance des flux ETL (Talend, SSIS), avec documentation associée, L'optimisation de l'entrepôt de données (Snowflake, MSSQL) en termes de fiabilité et de performance, Le support aux métiers (comités, mise à disposition des données, accompagnement utilisateurs), La participation aux projets BI : Développement, tests, mise en production, Le rôle de backup sur les flux opérationnels si nécessaire.   Poste évolutif.",2025-06-24T15:45:43.000Z,2025-06-24T15:45:43.000Z,59 - ST ANDRE LEZ LILLE,50.661146,3.040218,59350,59527,CDI,Contrat à durée indéterminée,Contrat travail,D,Débutant accepté,,,,,,,,,False,,,,,,,2,https://candidat.francetravail.fr/offres/recherche/detail/8647466,DIRECTEMPLOI (https://www.directemploi.com/candidatOffre/51816680?utm_source=pole-emploi&utm_medium=referral&utm_campaign=Pôle-Emploi),
8647423,Data Center System Engineer Senior H/F,"Notre client est une organisation de taille moyenne opérant dans le secteur Technology &amp; Telecoms. Spécialisé dans la conception et la gestion de systèmes technologiques, il se distingue par son approche centrée sur l'innovation et l'excellence technique.  En tant que Data Center System Engineer Senior, vous aurez les responsabilités suivantes : Superviser et maintenir les systèmes d'infrastructure des centres de données ; Diagnostiquer et résoudre les problématiques techniques complexes ; Mettre en oeuvre des solutions de virtualisation et d'optimisation des ressources ; Élaborer et exécuter des plans de continuité et de reprise après sinistre ; Collaborer avec les équipes internes pour assurer une intégration harmonieuse des nouveaux systèmes ; Documenter les procédures et les processus pour garantir une traçabilité optimale ; Réaliser des audits de performance et proposer des améliorations proactives ; Veiller à la conformité des systèmes avec les normes et réglementations en vigueur.   Notre client vous offre : Une rémunération compétitive ; Un contrat permanent avec des opportunités d'évolution ; Un environnement stimulant dans le secteur Technology &amp; Telecoms ; Un accès à des projets innovants et à des technologies de pointe ; Un équilibre entre vie professionnelle et personnelle ; 25 jours de CP + 20 RTT/an. Rejoignez une équipe engagée basée à Issus et contribuez à façonner l'avenir des technologies. Postulez dès maintenant pour le poste de Data Center System Engineer Senior.",2025-06-24T15:45:33.000Z,2025-06-24T15:45:33.000Z,95 - MAREIL EN FRANCE,49.069014,2.423699,95850,95365,CDI,Contrat à durée indéterminée,Contrat travail,D,Débutant accepté,,,,,,,,,False,,,,,,,2,https://candidat.francetravail.fr/offres/recherche/detail/8647423,DIRECTEMPLOI (https://www.directemploi.com/candidatOffre/51828961?utm_source=pole-emploi&utm_medium=referral&utm_campaign=Pôle-Emploi),
8647418,Data Platform Manager H/F,"Notre client est un acteur majeur international du secteur de l'industrie de la parfumerie et du développement d'arômes. Il commercialise ses produits pour des entreprises des secteurs pharmaceutique, agroalimentaire et luxe/cosmétique. Les locaux sont à Argenteuil (95) et il y a 2 jours de télétravail/semaine : Environnement international, DSI Globale de +500 personnes,  utilisateurs. L'entreprise accorde une grande importance à la diversité et à l'inclusion, tout en valorisant le développement personnel grâce à l'acquisition continue de nouvelles compétences. Processus de recrutement : 3 entretiens.En tant que Data Platform Manager, vous serez responsable de la stratégie, du développement et de la gestion de la plateforme de données (Snowflake), de l'ingénierie des données, de l'observabilité et de l'architecture, en alignement avec la stratégie IT. Vous garantirez que la plateforme répond aux besoins des utilisateurs et suit une approche produit. En tant que Data Platform Manager, vous aurez les responsabilités suivantes : Définir et maintenir la vision et la feuille de route de la plateforme, Manager l'équipe de la plateforme (Ingénieurs et Architectes), composée de 7 à 9 collaborateurs, Assurer la livraison des produits liés à la plateforme de données, Superviser les demandes commerciales et IT, planifier les ressources et atténuer les risques. En termes de leadership/management, vous aurezCollaborer avec les Responsables Produits et Architectes pour aligner stratégie business et IT, Prendre des décisions basées sur la valeur tout au long du cycle de vie du produit, S'assurer en permanence que l'architecture actuelle et future, les investissements et les solutions sont alignés avec la stratégie data/analytics, Promouvoir la plateforme auprès des départements Business et IT et dans les différents pays. Rémunération fixe attractive, Prime annuelle de 20%, Participation et plan d'épargne, Comité d'entreprise, Mutuelle intéressante, 40 jours de congés par an (25 CP + 15 RTT), Prise en charge partielle des frais de repas et de transport, Très belles opportunités de développement de carrière.",2025-06-24T15:45:32.000Z,2025-06-24T15:45:32.000Z,95 - ARGENTEUIL,48.948465,2.248202,95100,95018,CDI,Contrat à durée indéterminée,Contrat travail,D,Débutant accepté,,,,,,,,,False,,,,,,,2,https://candidat.francetravail.fr/offres/recherche/detail/8647418,DIRECTEMPLOI (https://www.directemploi.com/candidatOffre/51816446?utm_source=pole-emploi&utm_medium=referral&utm_campaign=Pôle-Emploi),
